{
  "ucs_version": "0.1.0",
  "profile_id": "a1b2c3d4-e5f6-7890-abcd-ef1234567890",
  "created_at": "2026-01-01T00:00:00Z",
  "updated_at": "2026-01-01T00:00:00Z",
  "schema_url": "https://ucs-standard.org/schema/v0.1.0/ucs.schema.json",
  "persona": {
    "communication_style": {
      "direct": 1.0
    }
  },
  "provenance": {
    "source_platforms": ["manual"],
    "extraction_method": "manual",
    "sanitised": true,
    "sanitised_at": "2026-01-01T00:00:00Z",
    "attestation_signature": null
  }
}
